,Unnamed: 0,text,label
0,1829,smoking my silly little weed and listening to my silly little tunes this is what life is about.,1
1,1218,"Never thought I would read someone describe a hardened criminal, with white supremacist tattoos, drug dealer who talks about dealing to kids as 'soft white underbelly'",1
2,940,Enforcing cannabis laws 'threatens police legitimacy' #GyoCannabisOrganically #growyourown,1
3,508,"and the fact that Sha'Carri smoked weed intentionally, and we don't know what happened in Valieva's case (athletes get various injections, including vitamin shots regularly), with that being said the investigation is ongoing",1
4,1130,Stage 4 pancreatic cancer patient in Florida oncologist not comfortable w pain meds and sent patients to PM. PM dr said they only do injections and sent him back to oncologist. Yet they stick to the narrative that everyone gets opioids for everything,0
5,2324,Did y'all know that studies show that people are less likely to have sex with strangers when high (weed) as opposed to drunk?,1
6,4152,Weed addict come on dawg 😂😂😂💀🤦🏾‍♂️,1
7,709,Cannabis Science Fair Event Will Showcase Efforts to Expand  mg Magazine CannabisNews ,1
8,2172,"have you seen yourself. ""Intellectual vegetable"" what you guys smokes in that your media outlet must be a strong weed from Kwale",1
9,383,"A federal judge ruled that programs Pfizer wanted to launch to provide copay assistance to Medicare patients would likely violate kickback laws, a controversial notion that has caused numerous drug makers to pay large fines. ",1
10,2211,"NFT GIVEAWAY!! We are giving away a PHAT PANDAZ NFT! To enter... 1 Like, Retweet and Tag 3 People 2 Follow and  This project is backed by a $500 Million Recreational Cannabis Company #NFTGiveaway #NFTs #CannabisCommunity ",1
11,315,"Wow!!! Miss Remini, the lies being perpetrated by this evil organization has me wanting to get back into law enforcement to weed out these soulless being. The whole Shelly Miscavige situation has me scratch it my head. What is wrong with California law enforcement ???",0
12,1225,"Cannabis Apes Yacht Club will be the next Big discovery. WL still Has available slots, respond if interested.",0
13,1146,Sort of thing you would expect with alcohol or cocaine Speed maybe Cannabis usualy causes lethargy and chilled out But yes I agree Ralph no one should be near a weapon on Drugs,1
14,312,MAN I DONT WANNA GO OUT AND SPEND MONEY. ALL I WANNA DO IS SMOKE WEED IN MY HOUSE.,1
15,1017,"RT A good spot on PC O's first day on the Traffic Unit! Moped sighted by #XT14 being ridden erratically in , rider detained and found to be in possession of a large quantity of cannabis, a knuckleduster and is also a disqualified driver. Rider arrested & moped seized. ",1
16,168,I bought half Oz of weed last week and it's all gone already... My tolerance is stupidly high so I'm considering a 5day tolerance break. Question is will 5 days be long enough to bring my tolerance down or do I just buy more dope?,1
17,2244,"I'm off 2 narcotics, 2 nausea meds and anxiety med thanks to cannabis. I was able to get off the j-tube (feeding tube) I had been on for 5 years and it has given me my life back.",1
18,157,"I don't want to mansplain unsolicited middle aged male advice, but if you're looking for big coffee energy, have you considered getting into coffee? You can even weigh out your stash on proper drug dealer scales and everything.",0
19,1784,"What gets me about this debacle is the Depp Stans on here trying to get Heard kicked out of movies the way Depp apparently was, as though it was the abuse allegations and not the years of substance abuse and shitty performances that did that.",0
20,2164,"Well, maybe not ""agenda."" But street dealers have a range of products. It's more likely that someone buying weed from a dealer will be offered other products than if they buy it from a dispensary.",1
21,617,$txtm  Wow ! Buckle up for the ride folks !  #CannabisCommunity #cannabis #CannabisMedicinal #hemp #cannabisindustry ,1
22,624,I just talked to a pillow on the couch next to me about the latest ep of the Staircase for several minutes thinking it was Bill so yeah I had too much weed,1
23,4017,have you ever thought about not smoking weed you drug addict? ,1
24,1635,A little bit of weed and some lucki got me thru harder times than therapy ever did #ongod,1
25,1637,RT The secret for success is drugs isn't it. Business? Coke. Art? Weed/lsd. Weight loss? Coke/weed. Is there anything sober people can do better thaan high folks?,1
26,4238,"RT Why don't we treat substance abuse like what it really is? A mental disorder. Those affected need medical support, not incarceration. ",1
27,2202,the way me and my friends used to listen to this album EVERYDAY and smoke shitty weed and steal home rolled cigarettes from our parents lmfaoo ,1
28,1512,RT It's official: Rio Grande do Norte police have won the War on Drugs ,1
29,22,"NEXT WEEK: ""Drug War Dragnet: Surveillance, Criminalization, and Freedom from Drug War Targeting"" April 27th 12-1:30 EST Keynote with April 28th 12-6pm EST Sessions with Amazing Speakers All Day! RSVP: ",1
30,342,Future archeologists gonna be like ok so is this one a weed pipe or tobacco pipe..wink wink lol,1
31,206,Chilling after a walk at 06:00 followed by helping me weed the front garden by 08:00. ,0
32,1178,We're growing weed in the community garden and giving it away for free! ,1
33,1305,"It's #NationalChocolateDay, so we're taking a moment to celebrate all of the cannabis-infused chocolates on the market. At CannaSafe, we test chocolate cannabis edibles for numerous clients, & our testing ensures that consumers receive safe, reliable products for consumption. ",1
34,275,"""Researchers found that those who exercised not only reduced their pain, but also had more of a type of microbe in their guts that produces anti-inflammatory substances"" #aging #exercise ",0
35,3983,You smoke weed to dull the pain of your willfull ignorance and stupidity. Pendejo,1
36,2341,This run has been beneficial in dialing in what I learned from the first grow. I'll be top dressing the other 4 this weekend with Gaia Green.  #organics #cannabis #growyourown ,1
37,1005,"fr like when am i gonna get a philly cheesesteak, some weed, and a bitch to give me head like- ",1
38,4137,"please stop smoking weed david, you are ruining your life. don't tell me ""you can't get addicted."" addict or not it's making you act in ways i don't like.",1
39,1347,"A Cannabis tax revenue centered around racial and economic justice is more than necessary. To make matters worse, #Virginia landlords are denying applicants with vouchers. #coinsnotcuffs #reparationsnow Check out the data here: ",1
40,2134,12 cannabis brands with excellent packaging - We LOVE your description of Her Highness. Thank you #WeedForWomanKind #PackagingPorn ,1
41,1025,"In his new budget, calls for increased funding to expand access to evidence-based prevention, harm reduction, treatment, and recovery support services, while reducing the supply of illicit drugs like fentanyl. Read more: ",1
42,4202,"RT The anti-drug campaign of the previous Duterte administration was characterized by the killing of thousands of drug suspects, mostly allegedly in armed encounters with law enforcers. | via ",1
43,647,I'm 44. I take an abundance of CBD and THC every day and I look like I am in my 20s. So kudos to you for being prejudiced. Good job   What you're describing is someone who probably uses tobacco products with their marijuana. That is what's causing them to look dirty. ,1
44,1614,I respect it! Honestly he's always been a fave canon character and I do feel fanon does him dirty sometimes so I am HERE this! Weasley is our Ginger Sex God King!,0
45,2206,Girl yesssss and she locked her ass in the apartment. She knows drug addict behavior and was acting accordingly  Shes gonna get her moneys worth one way or another,0
46,306,"And 90% of the time they have a foot/toes kink, 99% of the time they smoke weed",1
47,212,Diversifying is the  but you must learn to weed out the shitcoins influencers pump and dump! One way is to put some money into those and lose it! . It is what tities! ,0
48,1522,"Totally, i mean who wouldn't wanna see a drug addict, a friend cheating with her best friend's boyfriend, a girl cheating on the drug addict with a boy although she thought the boy was interested in the drug addict. To sum it up, you will never see this except in euphoria!",0
49,1572,House Overwhelmingly Removes Barriers To Cannabis Research - The Medical Marijuana Research Act passed the House on an overwhelming 343-75 vote. All the No votes came from the GOP. #leafnation,1
50,1638,"Agreed but weed, doesn't help peoples mentally just illnesses ",1
51,1027,"you used to smoke weed with me, didn't you I believe they're required BY LAW if you ask them if they're a *cop, they HAVE TO tell you.",1
52,1636,"Like a drug addict, if you want that drug bad enough you will find away by any means necessary to get it.",1
53,756,"When my loved ones are safe, sunrises, sunshine, sunsets, the moon is all her phases, weed, coffee, birds, flowers, walks, love, the momentum and hope of spring, chocolate, music, good conversation, accomplishment, rest, footbaths and doing my nails, showers, did I mention weed? ",1
54,1075,"THIS is the fool who introduced The States Reform Act today,which would remove cannabis from Schedule I drug classification.Not the best frontperson for our movement. Do we support science & truth-or just jump on board w/nubjobs? ",1
55,1168,Are you in #SanFrancisco!? Come check us out at booth 1312 at the #CannaBizSummit #Cannabis #AtomicCloser #TeamSTMCanna #STMCanna ,1
56,1189,Okay so on top of the hundred for food I am also in need of 30 for weed so that my mental state doesn't do a nose dive! The 30 would buy a pack of 7.5g which would last me till pay on the 20th.... #SingleNativeMother #Crowdfunding ,1
57,215,Contreras: Going to impose substance abuse testing and if necessary treatment.,1
58,1761,Lacson Open To Legalization Of Marijuana For Medical Purposes #Marijuana #MarijuanaNews,1
59,539,Not going to weed through the rest of the apology but the usage of sorry if that offends you really tells me all I need to know about you as a person.,0
60,2416,Why aren't we smoking weed and drinking coffee in bed?,1
61,1144,"Awe yeah, that wicked bull s**** IS coming to an end!!!!!! I give thanks to our fallen soldiers and their GODLY service Not a crises actor/drug addict",0
62,1505,Episode 4 is out! Talking #cannabis #research and more with Listen wherever you get #podcasts link:  #Chicago #PodcastAndChill ,1
63,172,"Cedric Richmond, senior adviser to Pres. Biden, says the President's proposal to reduce gun violence is ""unique"" because ""it looks at the root cause and it offers different solutions in terms of community violence intervention, substance abuse, mental health..."" ",0
64,2373,Weren't the taxes collected from the marijuana sales supposed to go to supporting the schools what happens to that ? Did you discover that if you put that kinda money into education we would have super students and we couldn't have that could we?,1
65,1693,Don't hold your breath. As long as you don't take away their video games and their weed they DGAF.,1
66,936,"And look at the percentage of insect by products allowed in US foods. Yet if one eat of one thing, you eat of them all, because it's all ONE",0
67,4074,"anti-drug campaign, like DARE",1
68,2082,"Dez Bryant, Berner, Cheech & Chong, Ricky Williams, Gary Vee, Carlos Condit, Ja Rule, Blocboy JB, Rich The Kid, and Sean O'Malley are just a few of the many fellow cannabis enthusiasts that are part of the club. #Cannabis #NFT #Crypto ",1
69,1684,"Drug prohibition won't keep my 13-year-old from getting drugs, and it actually logically makes it easier for him to access them. Not good. I hope he chooses to not use drugs, especially as a teenager. But if he crosses that threshold, the next question is what will he use? (4)",1
70,2304,"Loyalties ! As wispy as the proverbial, medicinal mary jane .Like the Doobie brothers sang ''l like my weed''",1
71,2466,"Legal #homegrow is about normalisation. There should be no special cannabis taxes, just as there are no special tomato taxes. IMO, one of the very few things we got right in Australia was banning state based taxes on goods and services. Adult use will be a different beast here.",1
72,610,"Afghanistan: Taliban bans opium poppy cultivation, drug trade The Taliban are taking steps to halt Afghanistan's opium trade even as the country's economy crumbles. It is unclear how the Taliban government plans to replace this illicit source of income for millions of farmers. ",1
73,1061,#LegalizeIndiana Indiana needs to legalize medical marijuana & for recreational use as well.,1
74,286,"Practically everyone I know who's triple/quadruple vaxxed has Covid right now, and many are beginning to openly express regret about taking the drug posing as a vaccine solely to avoid legal liability.",0
75,1018,I don't know who in Britain wants EU trading standards and who not but it doesn't seem to be automatic. The Germans legalising weed want regulation around it but the British drugs users don't. Is that a lens? @EU_Commission,1
76,2359,"The $1.5 billiondollars is from settlements negotiated with Johnson & Johnson, McKesson, Cardinal Health, Amerisource Bergen, and Endo following her March 2019 lawsuit against the various manufacturers and distributors responsible for the opioid crisis.",0
77,2071,"Nothing wrong in anointing Loud, God gave us the marijuana ",1
78,340,RT My entire stoner photocard collection! Retweet for good luck and good weed! ,1
79,1881,"Marijuana with the pills, euphoric and cerebral I do it all to chase a thrill",1
80,4006,chase the drug addict off your stoop.if you suffer from pain. they dont belong there under any circumstance.just there to steal your drugs an life away from you.,1
81,102,"RT Alcohol, tobacco, and marijuana are the most common substances used by youth. DFC grants program implements evidence-based prevention efforts to reduce youth substance use. #NYSUPMChat ",1
82,1905,"don't let the weed smoke you, you smoke the weed - princess",1
83,2376,"These are scammers taking advantage of the cannabis community, they have no #NFTs anywhere near $ where they claim. They collect #eth addresses to perform dusting attacks, DO NOT SELL ANY NFT YOU RECEIVE, THEY WILL EMPTY YOUR ACCOUNT. #cryptocurrency #Cryptos #CannabisCommunity ",1
84,1143,"*or district. Either way, it means making policing a profession would weed out a lot of bad cops and they can never be a cop again. It may not weed out all of them as the system is still rotten, but this idea is in the right direction. The only problem is getting it to pass.",0
85,1642,Check out our latest newness: #podcasting #CannabisCommunity,1
86,755,Damn you ain't even ask nothing crazy a nice dinner ain't nothing but 60 dollars I spend more on weed and shoes and gas now shit he cap but lowkey 1st date be burgerfi off a Groupon ,1
87,34,"New York legalized marijuana and is expunging possession and sale convictions. This is what justice looks like  and it's what every American deserves. It's time for the Senate to pass the MORE Act, legalize marijuana across the country, and expunge all non-violent convictions.",1
88,548,"Weed cat has been resurrected using dark magic and is now walking AMONG US once again This tweet was sponsored by ""daily weed cat related tweets"" ",0
89,1580,Lol hit me up if you in need of a reliable weed plug fam,1
90,421,This whole thing was to weed out the haters. They will face my wrath,0
91,603,#CPP yes let the CDC know you HAD a productive life with YES your whatever dose and opioids that worked for you your chemistry we have been harmed how many in the CPP have died !?! Due to the 2016 guidelines yet again we must comment it's 2022 50 million comments ,1
92,887,Might weed out the millions of fraudsters claiming multiple times for benefit's etc,0
93,1095,**We going to start a cannabis brand** -coffeeshop in Munich (exclusive access) -exclusive Events -get Roys & be a shareholder (passive income) -Monthly NFT airdrops -Meta-Land and much more.....we want to grow a healthy natural way to success ,1
94,4023,Same😭I am like a drug addict who needs drugs badly every day!!,1
95,1940,I'm pretty hedonistic and generally happy right now so I'm not sure I agree. But I doubt this will remain true forever. I can see myself quitting habitual weed in the not so distant future.,1
96,2189,"RT (13) In fact, I have, my entire life, been in situations where men take ALL THEIR CLOTHES OFF RIGHT IN FRONT OF ME (locker rooms, etc.).",0
97,4013,"Agbo, drug abuse and substance abuse, food, diabetes, hypertension.",0
98,310,#cannabiscommunity #marijuana #cannabis Republican Lawmaker's Bill Would Legalize Marijuana in Ohio Marijuana would be legalized in Ohio for adults 21 and older under Republican legislation coming in the Ohio House. The bill would encompass the ,1
99,1576,"This is a tacit admission that the war on drugs framework positions drug sellers/users, NOT drugs, as the enemy combatants. The war on drugs is a war on us, and its proponents would have us branded terrorists and war criminals. ",1
100,272,"Track of the Day: Escape' ""Grooving indie hooks and shimmering synths from Liverpool"" @Gigslutz_ For fans of The Killers, The War on Drugs, White Lies, The Peach Fuzz  Greg Hodge ",1
101,2291,We've got the weed. Holding out for the beak masks. #weed #memes #Mmemberville ,1
102,1545,I be thinking it's the weed frying my brain at this point ,1
103,631,"So, what's driving this stagnation in drug possession arrests? Look to methamphetamine, for which possession arrests virtually doubled from 2009 to 2019. Conversely, arrests for #marijuana plummeted during the same time. ",1
104,248,Anyone Else In Oklahoma Having Issues With Renewing Their Cannabis Card? ,1
105,2245,guys im not even joking i stopped buying weed and BAM $625 for wdw tickets ,1
106,1714,The fact that Biden has tons of unfulfilled campaign promises he can literally fix overnight via executive orders proves he's hot garbage. 4/20 would be a great day to decriminalize marijuana and expunge criminal records. ,1
107,806,Why do Nigerian people love weed? because what comes after 419 is 420,1
108,4285,"Marijuana, Cocaine and Opioids are the most common drugs of abuse reported in drug admissions in the Florida area. ",1
109,1575,"Your company's cannabis testing is still essential, even with widespread legalization, says Sammie Dabbs, our Senior VP of Sales. Read more advice straight from industry experts in this month's #HRProfessionalsMagazine. https://t.co/wFtxEfpHvp #HRtech #employeescreening",1
110,3864,"Kentucky drug overdose death increased 22% in September 2021 reporing 2,373 compared to 1,943 in 2020. Kentucky reports the highest economic cost of drug addiction in the country costing over $6,000 per addict. ",1
111,2035,It's about a former moonshiner family. A member returns from Vietnam and starts growing marijuana.,1
112,2311,More like phantom threading my pussy back together after I let him take a weed whacker to it in a horny way on the set of Young Sheldon,0
113,1436,"Naloxone, when administered in time, can reverse the effects of overdose from prescription opioids, heroin and fentanyl. Narcan, a nasal spray version, is available through pharmacies without a prescription. You can learn more at ",1
114,4082,"Police crackdown on drug smuggling: youth arrested with 500 tablets and sipper bottles, was running illegal business for many months ",1
115,80,I watched the Evil Dead when I was 8. I weed the bed for a couple of weeks.,0
116,593,Can't believe a tweet about weed started all of this  ,1
117,1268,"HIGH COMPLIANCE, A LEX LATA LEGALIZATION FOR THE NON-MEDICAL CANNABIS INDUSTRY How to regulate #recreational #cannabis in accordance with the Single Convention on narcotic drugs, 1961 #CND65 #HighCompliance",1
118,2353,id probably just have seasonal depression and ennui in winter and have to be kept under a lamp like a weed,0
119,3955,"That's the thing bro, I don't even smokebut the weed here just smells dirty. Has a must to it breh ",1
120,823,"Most Germans are not happy that another three nuclear reactors were shut down in the midst of the climate & energy crises. In order to oppose nuclear power, it takes a great intellectual effort: you have to believe the unbelievable. @Moms4G ",0
121,2252,"I'm happy this one is back, the weed is mid, still working through it. Those shrooms were fucking great though I'm definitely getting more for Halloween.",1
122,413,"I don't wanna go out and smoke weed, and then come home smelling like weed around my younger siblings.",1
123,2428,"Wake up, bake up #Mochiz #hemp #cannabis #Mmemberville #AskTwitter ",1
124,1379,"None of us wants to look at the problem that our very lax, Enabling policies have produced. Allowing unfettered drug abuse & encampments everywhere helps no one. It just Spurs addiction, crime, homelessness, filth, gangs & cartels.",1
125,1611,"Joey III is a corrupt, selfish young drug addict, ruler of one of the kingdoms, who brought his father Joey II to a heart attack, as a result of which the throne passed to him. ONLY 0.02 ETH https://t.co/0DdsOxyW2c #cryptoart #nft #nftcommunity #nftartist #digitalartist #opensea ",0
126,1613,All the good ones leave. Thank you for your efforts in trying to end Cannabis prohibition. ,1
127,2238,"Your proposed laws must reflect reality. About 60% of gun deaths are suicides, majority of rest are gang/drug or domestic violence. NONE of these would be impacted by your proposed laws. Criminals will not hand in the tools of their trade; they don't buy at FFL or gun shows.",0
128,4272,"Drug addict on AF1, you mean Don Jr, right? The guy that has so much cocaine in him at any given time, Tony Montana is jealous... Get fucked you fascist, Nazi scum.",1
129,8,I'm trying to make my flame thrower snow & weed removal & performance business happen. I think it's a winner.,0
130,2064,Oh good a granny drug dealer speaking. Maybe she will give her recipe for her lucky charms. ,1
131,2232,if you(germany) legalize sweden will follow. Sweden is one of the most retarded nations when it comes to cannabis and other drugs. Would be a huge gift.,1
132,1540,"RT Quoted in ""Elections were designed to weed out the world's worst rights abusers. But 'oppressive regimes like China, Cuba, Libya, Russia and Eritrea routinely win election, and the stamp of international legitimacy,' said Hillel Neuer."" ",0
133,750,"Feb 11th, 2022. Industry night for the cannabis community. will host a night of fun for all those working in cannabis. Free event for the industry. #secretseshnfts ",1
134,2215,"Steven Stamkos said he got to have dinner with his parents in Toronto, but other than that he's treating it like another playoff game. Joked he's been able to weed out all the ticket requests since his early trips in his career. @TBLightning",0
135,2179,BUY WEED IN GLASGOW GO TO THE WEBSITE BELOW THE PLACE YOUR ORDER NOW. https://t.co/BwtKrDwa7D CONTACT Kik : caliweeduk420 Wickr : caliweeduk420 Email : caliweeduk420@gmail.com,1
136,613,THESE BURNS ARE LIKE IGNITION OF DRIED FRONT OF THE MOUNTAIN... THE FIRE IS NOT YET OUT OF CONTROL... DRY WEED IS APPROACHING TO THE FOREST.... #FEG FIRE IS APPROACHING... FIRE IS COMING SOON...,0
137,97,"I think gummies or capsules really help older people who are afraid of the stigma of weed. My aunt buys these incredible cbd oil capsules, i can ask her where she gets them if you want.",1
138,3999,"Bruh! Whatever problem you be going through in life, pls do not eat edible weed. I regret it. I was in a different world , I was hallucinating, I could see my heartbeat, I could hear plants talk. I was running mad. ",1
139,1345,"At our fall extension weed scientist meeting, we had a chance to record a podcast with our thoughts about weed control in the herbicide shortage era. ",0
140,278,"hina khan, shrenu parikh, jennifer winget a sex worker, a divorcee and a drug addict, all three shunned by the society, out together on one common missionrevenge. ",0
141,1041,"Think the MORE Act repeals all marijuana crimes? Think again, because it creates new marijuana crimes that could result in someone spending the rest of his or her life time in prison and losing the ability to vote and the right to own a firearm. ",1
142,3928,Yeah ppl be going anywhere buying weed issa no for me,1
143,447,"RT Case 10: Another child being held due to a questionable traffic stop, this one involving the smell of marijuana. He is asking for home detention and the ability to go to school and participate in pre scheduled after school activities.",1
144,13,"Deadly drugs like fentanyl cross the US border every day, but preferred to declare war on the importation of Mexican avocados instead of drugs, affecting at least 300,000 direct jobs, and more than 1,000 ,000 indirect. ",1
145,746,there's a town a few hours away from mine called weed,0
146,2177,the kinda weed everybody got be smoking them ian tryna lose weight,1
147,1121,Nah weed is just not for me can't believe y'all enjoy this feeling,1
148,790,DOWNLOADING WEED.EXE. holy shiiiiiiiiiiiiiit. wow.#metalscourge ,0
149,916,Did not know cannabis could accept the lord Jesus as it's savior,1
150,895,Interesting Matt. We have a couple of customers that had waterhemp introduced to their farm by combines that they purchased from the Midwest. Very difficult to clean a combine and make it weed seed free. Maybe this would have helped.,0
151,1677,"Love me some Chris Rock, don't care for Will Smith at all. Chris should have pressed charges. Guy is flipping crazy. I hope he's never invited back to the Oscars! But ya, id bitch slap anyone for dissing cannabis, better yet, a punch to the throat, lol. ",0
